Title,Company,Location,Experience,Salary,Technologies,Source
Middle Python Developer,Comparus UA (Компарус.ЮА, ТОВ),Дніпро,,None,Redis; Docker; OpenShift; REST,djinni.co
Python developer (IRC224147),GlobalLogic Ukraine,Remote,,None,RDS; Git,djinni.co
Python developer (Middle/Senior),Project Ukraine,Remote,,None,Django; PostgreSQL; Git; REST; PyTest; Unittest,djinni.co
Python Developer,PNN Soft,Київ,,None,PostgreSQL; MySQL; MongoDB; AWS; RDS; Docker; Git; React,djinni.co
Machine Learning, Python Developer,Logivations,Львів,,None,FastAPI; Docker; REST; NumPy; Make,djinni.co
Викладач у дитячу IT-школу програмування (Scratch, Python, Комп'ютерна грамотність)),Logika, мiжнародна школа програмування для дiтей,Миронівка,,6,,djinni.co
PHP, Python Developer,Treeum,Remote,,None,Docker; Selenium,djinni.co
Junior Python developer (cloud backend),Codeavors, stealth German technology startup,Remote,,18,MongoDB; Redis; Git; Angular,djinni.co
Викладач у дитячу IT-школу програмування (геймдизайн, Scratch, Python, комп'ютерна грамотність),Logika, мiжнародна школа програмування для дiтей,Ірпінь,,14,JavaScript; HTML; CSS,djinni.co
Python Developer,Ronis Commerce OÜ,Remote,,None,RESTful APIs; PostgreSQL; MySQL; Docker; Git; REST; JavaScript,djinni.co
Викладач JS, CSS, HTML, Python, Unity (програмування для дітей),Romstal Лiвобережний,Київ,,None,React,djinni.co
Викладач JS, CSS, HTML, Python, Unity (програмування для дітей),SitePro,Київ,,10,React,djinni.co
Intern Python, JavaScript, UX/UI, QA Developer,SpecInterns,Remote,,None,Django; Flask; FastAPI; REST; PyTest; Unittest; Selenium; JavaScript; Requests,djinni.co
Python Web Developer,Клинико-Терапевтический институт, ООО,Remote,,20,Django; Flask; FastAPI; PostgreSQL; MongoDB; Redis; Docker; Git; REST,djinni.co
Викладач програмування (Scratch, Python),Logika, мiжнародна школа програмування для дiтей,Київ,,12,,djinni.co
Python Backend developer,Benning,Remote,,20,Django; PostgreSQL; MySQL; Redis; AWS; RDS; REST; asyncio; Celery,djinni.co
Викладач програмування у IT-школу (Python, Game design),Logika, мiжнародна школа програмування для дiтей,Сміла,,6,,djinni.co
Python developer (Trainee, Junior),Appexoft,Львів,,None,Django; PostgreSQL; MySQL; Git; REST,djinni.co
Python developer,Quintagroup,Remote,,None,Django; Flask; AWS; Git; REST,djinni.co
Викладач програмування для дітей (Scratch, Roblox, Python Minecraft),Paradigm School,Remote,,13,,djinni.co
Python Backend Developer (Ninja, Startup from Germany),CheckForPet,Remote,,90,Django; RESTful APIs; PostgreSQL; AWS; REST,djinni.co
Викладач IT (Python),Step,Калуш,,None,,djinni.co
Junior, Middle Python Developer,Інсайдери,Львів,,None,Django; PostgreSQL; MySQL; Git,djinni.co
Python-програміст,ForceService,Remote,,20,Flask; FastAPI; PostgreSQL; MySQL; SQLite; MongoDB; Selenium; aiohttp; Requests,djinni.co
Викладач в всеукраїнську школу програмування (КГ, Scratch, Roblox, Front-end, Python),Logika, мiжнародна школа програмування для дiтей,Вишгород,,12,JavaScript; HTML; CSS,djinni.co
Senior Python Developer,Aesthetics360,Remote,,360,FastAPI; PostgreSQL; AWS; EC2; S3; RDS; Lambda; Docker; Kubernetes; Jenkins; GitLab CI; GitHub Actions; Git; Terraform; pip,djinni.co
Middle Python developer,Avivi,Хмельницький,,None,Django; Flask; FastAPI; Redis; AWS; Docker; Git; Celery,djinni.co
Full Stack Developer (Python),Dinamicka Development,Київ,,None,Django; PostgreSQL; MySQL; AWS; Docker; Kubernetes; JavaScript; React; Angular; HTML; CSS,djinni.co
Senior Software Engineer (Python),Komet Studio,Remote,,25,AWS; SciPy; OpenCV,djinni.co
Backend developer (Python, PHP),Zviger, LLC,Remote,,None,Docker; Selenium; JavaScript,djinni.co
Middle Odoo, Python Developer,CR&D,Remote,,None,Git; JavaScript,djinni.co
Python-програміст,Logic Stream,Київ,,27,,djinni.co
Викладач у дитячу ІТ-школу програмування (Scratch, Python, геймдизайн),Logika, мiжнародна школа програмування для дiтей,Червоноград,,4,,djinni.co
Python developer,Idevone,Remote,,15,Django; Flask,djinni.co
Full Stack Python developer,LightSoft,Remote,,None,Django; PostgreSQL; Redis; RDS; Docker; REST; Celery; HTML; CSS; Make,djinni.co
Викладач програмування у дитячу школу (Python),Logika, мiжнародна школа програмування для дiтей,Remote,,10,JavaScript; HTML; CSS,djinni.co
